text,smr_angry,smr_impatient,smr_neutral,smr_nice,smr_excited
"The Hebrew Bible identifies Joshua as one of the twelve spies of Israel sent by Moses to explore the land of Canaan. In Numbers 13:1 and after the death of Moses, he led the Israelite tribes in the conquest of Canaan, and allocated lands to the tribes. According to biblical chronology, Joshua lived some time in the Bronze Age. According to Joshua 24:29 Joshua died at the age of 110.
Joshua holds a position of respect among Muslims, who also see him as the leader of the faithful following the death of Moses. In Islam, it is also believed that Yusha bin Nun (Joshua) was the ""attendant"" of Moses mentioned in the Quran before Moses meets Khidr. Joshua plays a role in Islamic literature, with significant narration in the hadith","Joshua, a prominent figure in the Hebrew Bible, was one of the twelve spies sent to explore Canaan and later led the Israelite conquest of the land after Moses' death. He is respected in both Judaism and Islam, where he is recognized as a faithful leader and attendant of Moses. Joshua is noted to have lived during the Bronze Age and died at the age of 110.","Joshua was one of the twelve spies sent by Moses to scout Canaan and later led the Israelites in its conquest after Moses' death, living in the Bronze Age and dying at 110. He is respected in Islam as well, seen as a faithful leader and mentioned in the Quran as Moses' attendant.","Joshua, a biblical figure identified as one of the twelve spies sent by Moses, led the Israelites in the conquest of Canaan after Moses' death and allocated land to the tribes. He is respected in both Judaism and Islam, where he is recognized as a leader following Moses and is mentioned in the Quran as Yusha bin Nun. According to biblical accounts, Joshua lived during the Bronze Age and died at the age of 110.","Joshua, a prominent figure in the Hebrew Bible, was one of the twelve spies sent by Moses to scout Canaan and later led the Israelite tribes in its conquest after Moses' death. He is respected in both Judaism and Islam, with Muslims recognizing him as Yusha bin Nun, the attendant of Moses, and acknowledging his leadership and significance in Islamic literature. According to biblical accounts, Joshua lived during the Bronze Age and died at the age of 110.","Joshua, a key figure in the Hebrew Bible, was one of the twelve spies sent by Moses to scout Canaan and later led the Israelite tribes in their conquest of the land after Moses' death, allocating territories to the tribes before dying at the age of 110. He is also respected in Islam as Yusha bin Nun, believed to be Moses' attendant and a leader of the faithful, with his story referenced in the Quran and hadith."
"Apple Inc. is an American multinational corporation and technology company headquartered and incorporated in Cupertino, California, in Silicon Valley. It is best known for its consumer electronics, software, and services. Founded in 1976 as Apple Computer Company by Steve Jobs, Steve Wozniak and Ronald Wayne, the company was incorporated by Jobs and Wozniak as Apple Computer, Inc. the following year. It was renamed Apple Inc. in 2007 as the company had expanded its focus from computers to consumer electronics. Apple is the largest technology company by revenue, with US$383.29 billion in 2023.The company was founded to produce and market Wozniak's Apple I personal computer. Its second computer, the Apple II, became a best seller as one of the first mass-produced microcomputers. Apple introduced the Lisa in 1983 and the Macintosh in 1984, as some of the first computers to use a graphical user interface and a mouse. By 1985, internal company problems led to Jobs leaving to form NeXT, Inc., and Wozniak withdrawing to other ventures; John Sculley served as long-time CEO for over a decade. In the 1990s, Apple lost considerable market share in the personal computer industry to the lower-priced Wintel duopoly of the Microsoft Windows operating system on Intel-powered PC clones. In 1997, Apple was weeks away from bankruptcy. To resolve its failed operating system strategy, it bought NeXT, effectively bringing Jobs back to the company, who guided Apple back to profitability over the next decade with the introductions of the iMac, iPod, iPhone, and iPad devices to critical acclaim as well as the iTunes Store, launching the ""Think different"" advertising campaign, and opening the Apple Store retail chain. These moves elevated Apple to consistently be one of the world's most valuable brands since about 2010. Jobs resigned in 2011 for health reasons, and died two months later; he was succeeded as CEO by Tim Cook.
Apple's current product lineup includes portable and home hardware such as the iPhone, iPad, Apple Watch, Mac, and Apple TV; operating systems such as iOS, iPadOS, and macOS; and various software and services including Apple Pay, iCloud, and multimedia streaming services like Apple Music and Apple TV+. Apple is one of the Big Five American information technology companies;[a] for the most part since 2011,[b] Apple has been the world's largest company by market capitalization, and, as of 2023, is the largest manufacturing company by revenue, the fourth-largest personal computer vendor by unit sales, the largest vendor of tablet computers, and the largest vendor of mobile phones in the world.
Apple became the first publicly traded U.S. company to be valued at over $1 trillion in 2018, and, as of June 2024, is valued at just over $3.2 trillion. It has received criticism regarding its contractors' labor practices, its relationship with trade unions, its environmental practices, and its business ethics, including anti-competitive practices and materials sourcing. Nevertheless, the company has a large following and enjoys a high level of brand loyalty.","Apple Inc., founded in 1976 by Steve Jobs, Steve Wozniak, and Ronald Wayne, is a leading American technology company known for its consumer electronics and software, including the iPhone, iPad, and Mac. After facing significant challenges in the 1990s, the return of Jobs in 1997 helped revitalize the company, leading to substantial growth and making Apple the first U.S. company valued at over $1 trillion in 2018. Despite criticisms regarding labor practices and business ethics, Apple remains a highly valuable brand with a loyal customer base.","Apple Inc., founded in 1976 by Steve Jobs, Steve Wozniak, and Ronald Wayne, is a leading American technology company known for its consumer electronics and software, generating $383.29 billion in revenue in 2023. After struggling in the 1990s, the company rebounded under Jobs' leadership with innovative products like the iPhone and iPad, becoming the first U.S. company valued at over $1 trillion in 2018. Despite criticisms regarding labor practices and business ethics, Apple maintains a strong brand loyalty and is currently valued at over $3.2 trillion.","Apple Inc., founded in 1976 by Steve Jobs, Steve Wozniak, and Ronald Wayne, is a leading American technology company known for its consumer electronics and software, with revenue of $383.29 billion in 2023. Initially focused on personal computers, Apple expanded its product line to include iPhones, iPads, and various services, becoming the largest technology company by market capitalization and revenue. Despite facing criticism over labor practices and business ethics, Apple maintains a significant global presence and strong brand loyalty.","Apple Inc., founded in 1976, is a leading American technology company known for its consumer electronics, software, and services, with a revenue of $383.29 billion in 2023. Originally focused on personal computers, the company expanded its product lineup to include devices like the iPhone and iPad, becoming the largest technology company by revenue and consistently one of the world's most valuable brands. Despite facing criticism regarding labor practices and business ethics, Apple maintains a strong customer base and brand loyalty.","Apple Inc. is a leading American technology company founded in 1976, known for its innovative consumer electronics, software, and services, including iconic products like the iPhone and iPad. After facing significant challenges in the 1990s, Apple rebounded under Steve Jobs and has since become the largest technology company by revenue, valued at over $3.2 trillion as of June 2024. Despite criticism regarding labor practices and ethics, Apple maintains a strong brand loyalty and is one of the most valuable brands globally."
"Tel Aviv is governed by the Tel Aviv-Yafo Municipality, headed by Mayor Ron Huldai, and is home to most of Israel's foreign embassies.[b] It is a beta+ world city and is ranked 57th in the 2022 Global Financial Centres Index. Tel Aviv has the third- or fourth-largest economy and the largest economy per capita in the Middle East.[11][12] Tel Aviv is ranked the 4th top global startup ecosystem hub.[13][14] The city currently has the highest cost of living in the world.[15][16] Tel Aviv receives over 2.5 million international visitors annually.[17][18] Tel Aviv is home to Tel Aviv University, the largest university in the country with more than 30,000 students.
The city was founded in 1909 by the Yishuv (Jewish residents) and initially given the Hebrew name Ahuzat Bayit (Hebrew: אחוזת בית, lit. 'House Estate' or 'Homestead'),[19][20] namesake of the Jewish association which established the neighbourhood as a modern housing estate on the outskirts of the ancient port city of Jaffa (Yafo in Hebrew), then part of the Mutasarrifate of Jerusalem within the Ottoman Empire. Its name was changed the following year to Tel Aviv, after the biblical name Tel Abib (lit. ""Tell of Spring"") adopted by Nahum Sokolow as the title for his Hebrew translation of Theodor Herzl's 1902 novel Altneuland (""Old New Land""). Other Jewish suburbs of Jaffa had been established before Tel Aviv, the oldest among them being Neve Tzedek.[21] Tel Aviv was given township status within the Jaffa Municipality in 1921, and became independent from Jaffa in 1934.[22][23] Immigration by mostly Jewish refugees meant that the growth of Tel Aviv soon outpaced that of Jaffa, which had a majority Arab population at the time.[24] In 1948, the Israeli Declaration of Independence was proclaimed in the city, with Tel Aviv named as the founding capital of Israel – a function it retained officially until 1950.[25] After the 1947–1949 Palestine war, Tel Aviv began the municipal annexation of parts of Jaffa, fully unified with Jaffa under the name Tel Aviv in April 1950, and was formally renamed to Tel Aviv-Yafo in August 1950.[26]
Tel Aviv's White City, designated a UNESCO World Heritage Site in 2003, comprises the world's largest concentration of International Style buildings, including Bauhaus and other related modernist architectural styles.[27][28] Popular attractions include Old Jaffa, the Eretz ","Tel Aviv, governed by Mayor Ron Huldai, is a major global city known for its significant economy and high cost of living, attracting over 2.5 million international visitors annually. Founded in 1909, it has a rich history and is home to Tel Aviv University, as well as a UNESCO World Heritage Site showcasing modernist architecture. The city was proclaimed the founding capital of Israel in 1948 and has since grown significantly, merging with Jaffa in 1950.","Tel Aviv, governed by Mayor Ron Huldai, is a major global city with a strong economy, high cost of living, and vibrant startup ecosystem. Founded in 1909, it transformed from a modern housing estate to an independent city, becoming the first capital of Israel in 1948. The city features a UNESCO-designated White City, noted for its Bauhaus architecture, and attracts over 2.5 million international visitors annually.","Tel Aviv, governed by Mayor Ron Huldai, is a significant global city ranked 57th in the 2022 Global Financial Centres Index and is known for having the highest cost of living worldwide. Founded in 1909 and originally named Ahuzat Bayit, it became a major economic and cultural hub, housing the largest university in Israel and the fourth leading startup ecosystem globally. The city is also recognized for its UNESCO-designated White City, which features a concentration of modernist architecture.","Tel Aviv, governed by Mayor Ron Huldai, is a major global city and the largest economy per capita in the Middle East, known for its high cost of living and vibrant startup ecosystem. Founded in 1909, it evolved from a Jewish housing estate to Israel's founding capital, officially named Tel Aviv-Yafo after unifying with Jaffa in 1950. The city is also recognized for its UNESCO World Heritage Site, the White City, which features a significant concentration of International Style architecture.","Tel Aviv, governed by Mayor Ron Huldai, is a significant global city known for its vibrant economy, ranking as the fourth top startup ecosystem and having the highest cost of living in the world. Founded in 1909, it has a rich history tied to Jewish immigration and was the founding capital of Israel in 1948. The city is also notable for its UNESCO World Heritage Site, the White City, which features a large collection of International Style architecture."
"I feel really sorry for the girls who have to undergo an already difficult process, but at a time when their bodies can barely cope with it. However, since sex is a human instinct developed for the survival of our species, I see no reason why girls should be shamed because they are pregnant. Equally, I don’t think girls who choose to have an abortion should be shamed. They have decided not to have a baby, and that is a totally acceptable decision, and often the best one for teenagers. We need to stop the stigma around teenage pregnancy","The author expresses sympathy for girls facing pregnancy and believes they should not be shamed for it, as it is a natural instinct. They also advocate for the acceptance of abortion as a valid choice, emphasizing the need to eliminate stigma surrounding teenage pregnancy.","The author expresses sympathy for girls facing pregnancy challenges and argues against shaming them for being pregnant or choosing abortion, emphasizing that both decisions can be valid and acceptable. They call for an end to the stigma surrounding teenage pregnancy.",The author expresses sympathy for girls facing the challenges of pregnancy during adolescence and argues against shaming either pregnant teens or those who choose to have abortions. They emphasize the importance of accepting both decisions and advocate for reducing the stigma surrounding teenage pregnancy.,"The author expresses sympathy for girls facing the challenges of pregnancy and emphasizes that they should not be shamed for it, as it is a natural instinct. They also advocate against shaming girls who choose to have an abortion, asserting that such decisions can be valid and often the best choice for teenagers. The overall message calls for an end to the stigma surrounding teenage pregnancy.","The author expresses sympathy for girls facing the challenges of pregnancy, emphasizing that they should not be shamed for being pregnant or for choosing to have an abortion. Recognizing that both decisions can be valid and often necessary for teenagers, the writer calls for an end to the stigma surrounding teenage pregnancy."
"I am extremely fortunate. I was born in Dominica to a father who was part of a generation of great Caribbean men. He believed in equality, and he believed in me. To him, his daughters were just as exceptional as his sons, and with my mother, he loved us and supported us while teaching us about duty, responsibility and service. 

Throughout my life and career, I have learned that, whether in the home, in work, or in political and economic systems, this enabling environment for women is not the norm. We have seen huge progress through the decades of my life, but gender equality remains far from being a reality. This is not just a concern for people who advocate for women’s rights; it impacts everyone, shaping the world we all share.

The World Bank estimates that inequality in earnings between women and men is costing our world $160 trillion – equivalent to around $23,620 per person. This figure is yet another reminder that when gender inequality persists in our society, we all lose. But it does not have to be this way.

Right now, there are exceptional leaders across the international system. From great Commonwealth Heads of Government including, Mia Mottley (Barbados) and Fiamē Naomi Mataʻafa (Samoa), to my dear sister Ngozi Okonjo-Iweala, leading the World Trade Organization, women leaders are driving real progress despite formidable challenges.

But they remain exceptions rather than the norm. Unfortunately, most women are disenfranchised, not by choice, but by prevailing structures. They struggle to provide for their families, face barriers to education and are constrained from taking up leadership roles ","The author reflects on their fortunate upbringing in Dominica, highlighting the support of their parents and the importance of gender equality. Despite progress over the years, they emphasize that gender inequality persists, impacting everyone and costing the global economy significantly. While there are notable women leaders making strides, the majority of women still face systemic barriers that limit their opportunities and contributions.","The author reflects on their fortunate upbringing in Dominica, highlighting the support and equality instilled by their parents. Despite progress, gender inequality persists globally, costing the world $160 trillion, and most women face significant barriers to education and leadership. While some female leaders are making strides, they remain exceptions in a system that often disenfranchises women.","The author reflects on their fortunate upbringing in Dominica, emphasizing their father's belief in gender equality and support for his daughters. Despite progress made over the years, gender inequality continues to be a significant global issue, costing the world $160 trillion in lost earnings. While some women leaders are making strides in various fields, the majority of women still face systemic barriers that hinder their opportunities and contributions.","The author reflects on their fortunate upbringing in Dominica, highlighting the support from their parents in promoting equality for women. Despite progress over the years, gender inequality continues to impact society and the economy significantly, costing an estimated $160 trillion globally. While there are notable women leaders making strides, most women still face systemic barriers that hinder their opportunities for education and leadership.","The author reflects on their fortunate upbringing in Dominica, emphasizing the support and belief in equality instilled by their parents. While acknowledging progress in gender equality, they highlight the ongoing systemic issues that disenfranchise women, resulting in significant economic costs globally. The text calls attention to the exceptional women leaders making strides in various sectors, yet underscores that they remain the exception rather than the norm, as many women continue to face barriers to opportunity and leadership."
